{
  "$schema": "urn:pfi-snt:run-metadata:schema:1.0.0",
  "schemaVersion": "1.0.0",
  "protocol": "measurement-protocol",
  "repositoryCommit": "389ca160b2a490cd66bb0194f012e2b75b3598e8",
  "sut": "baseline",
  "dataset": {
    "seed": 20260727,
    "sha256": "de523ee8fafeed0a39f8518b501fce4692192869030762816de353654385163d",
    "manifestSHA256": "e316f7f64148c919680a0edaec8b7bf881a58ea85602edeb0c9f1e3c301a6887",
    "units": 50000
  },
  "host": {
    "cpu": "AMD Ryzen 7 7800X3D 8-Core Processor",
    "cpuCores": 6,
    "memoryGB": 7.756,
    "os": "Ubuntu 24.04.4 LTS",
    "kernel": "6.18.33.2-microsoft-standard-WSL2",
    "wsl": "WSL2 Ubuntu-24.04"
  },
  "environment": {
    "docker": "29.7.2",
    "dockerCompose": "5.4.0",
    "baselineCommit": "389ca160b2a490cd66bb0194f012e2b75b3598e8",
    "baselineImage": "sha256:c9dc6ed2e16e61bd0e5cca5582f7069b1657c32741ee86d118cc9f71ef30be09",
    "postgres": "16.15-alpine"
  },
  "scenario": "mixed",
  "phase": "measurement",
  "repetition": 5,
  "workers": 2,
  "durationSeconds": 120,
  "rate": {
    "operation": "mixed",
    "transactionsPerOperation": 1.55,
    "targetOperationsPerSecond": 20,
    "targetTransactionsPerSecond": 31,
    "effectiveTransactionsPerSecond": 31,
    "rateController": "fixed-rate",
    "mix": {
      "register": 10,
      "transfer": 55,
      "dispense": 10,
      "query": 25
    }
  },
  "startedAt": "2026-10-22T08:17:49.597Z",
  "endedAt": "2026-10-22T08:19:49.597Z",
  "notes": "Ronda individual de la baseline REST; la serie estadistica y el procesamiento comparativo permanecen fuera de este runner."
}
